id,text,polarization,text_en
arb_a161f60cc7fd54778db1236553e4e7d9,إذا اردت النوم بسرعة والنوم طوال الليل,0,"If you want to sleep fast and sleep all night,"
arb_5270d2b63a6e06153b13de4cc94c013e,على من يستقوي الحزب ؟ #لبنان,0,Who's the party's leader?
arb_e5be516cbed8e868f76467c87f91b542,"""وزير المال نشهد له بمناقبيته""... عدوان: لتسليم كلّ الأسلحة غير الشرعية للجيش",0,The Minister of Finance is witnessing to him his opponent... aggression: to hand over all illegal weapons to the army.
arb_474d2a219590f448eeaa6ba530ebf1a7,أكثر من 250 ألف شخص يوقعون عريضة لتجريد إيلون ماسك من جنسيته الكندية,0,"Over 250,000 people sign a petition to strip Elon Mask of Canadian citizenship."
arb_fd084197dafc6ebf8566f640312bf9fc,معلومات عن اطلاق نار بين باب التبانة وجبل محست=ن,0,Information about a shooting between the Milky Way and Mount Hmm?
arb_9c7fdbc87266cf1463da741e6396647f,بعد استهداف نصرالله... صفي الدين طلب خرائط الموقع المستهدف وهذا ما قام به,0,"After Nasrallah was targeted... Safi al-Din requested maps of the target site, and that's what he did."
arb_4ef8169c154c75318f7a230898d50020,"الأخت #مايا_زيادة تتحرر من ""المنفى"" وتكشف رحلة ""الصلب"" من #جنوب_لبنان إلى #إيطاليا: كنيستنا فيها عفن",0,Sister Maya's increasing freedom from exile reveals a journey of steel from southern Lebanon to Italy: our church has mold.
arb_5ffa7102511933bf6719e662cce6ec5f,غارات إسرائيلية استهدفت مواقع عسكرية واستراتيجية في سوريا... وإسرائيل تتوعّد: لن نسمح لجنوب سوريا أن يصبح جنوب لبنان,0,Israeli raids targeting military and strategic positions in Syria... and Israel is promising: we will not allow southern Syria to become southern Lebanon.
arb_6af3e48e91de69d6bfbd3a33ca77d255,سجال في البرلمان اللبناني... لمن قال بري: دورك خلص؟,0,"Registered in the Lebanese Parliament... who said Bree, ""Your turn is done?"""
arb_ee554ac3aeede6ba4bf03cdeeb8289d2,"إحالة المعتدين على #""اليونيفيل"" على طريق المطار للعسكرية: أحرقوا الآلية بالمولوتوف",0,The attacker's transfer to UNIFIL on the airport road to the military: burn the robot with Molotov.
arb_a006628c60d4e1c58c368ea28ca73c77,"عن ""البيجر"".. الموساد يُفصح عن معلومات للمرة الأولى",0,About Albiger... the Mossad reveals information for the first time.
arb_eb8e80a22f520065434880e9005cada3,#عاجل - اتفاق بين إسرائيل وحماس لتبادل سجناء فلسطينيين تأخر إطلاقهم بجثامين أربع رهائن إسرائيليين,0,#Hurry - Agreement between Israel and Hamas for the exchange of Palestinian prisoners whose release was delayed by four Israeli hostages
arb_6279a854d40930485f00f6645583d1cf,عمر حرفوش يكشف تفاصيل حالة البابا فرنسيس وصراع الفاتيكان السري: معلومات خطيرة من داخل البيت الأبيض 2,0,Omar Harfush reveals the details of the case of Pope Francis and the secret Vatican conflict: dangerous information from inside White House 2.
arb_41376c7f0c65a1b68730af96d2492df0,"""اليازا"": حادث جديد في المكان نفسه حيث قضى الفنان جورج الراسي... من يعتبر؟",0,"""Yaza: A new incident in the same place where artist George spent the head... who's considered?"
arb_5f0b61faeb60d12e67f3481f47d4af3d,نائب يكشف: لهذا السبب لم يحضر جبران باسيل تشييع نصرالله,0,Deputy Discovery: That's why Jibran Basil didn't come to Shia Nasrallah.
arb_af848030196956007d07d233ff961fef,وجود شابين اعتمرا قبعة ووضعا كمامة في عزاء نصرالله وصفي الدين,0,Having two young men wear a hat and put a muzzle in the comfort of Nasrallah and Safi al-Din
arb_fb16b9362042669b04f4e5f1c8d32b63,ما إمكانية رؤية هلال رمضان .. وكيف سيتشكل؟ #عمون #الاردن,0,What is the possibility of seeing Ramadan and how it will form?
arb_4a161e94cddd7401dcf6967c8773bea9,فوائد شرب الماء مع عصير الليمون في الصباح,0,The benefits of drinking water with lemonade in the morning.
arb_901ac4c3941b9e8f5b35c8d29d59ef90,دائرة الإفتاء أفتت بتحريم السجائر الإلكترونية فجوبهت بتحليلات يعجز عنها الشيطان | وزير الأوقاف والمقدسات الإسلامية محمد الخلايلة #الأردن #وزارة_الأوقاف #دائرة_الإفتاء #التدخين #هنا_المملكة,0,"The advisory circle was fascinated by the ban on electronic cigarettes, and it was confronted with analyses that the devil couldn't afford."
arb_e3affd00ba07ff8f2aea7720b367e449,الصقيع صباح الثلاثاء في الرمثا #عمون #الاردن,0,"Frost, Tuesday morning, in the mantra, Amon Al-Arden."
arb_3c52086c8ca9c97252d427f2f3a0d138,الأردن .. وزارة التربية: ضباط ارتباط في المدارس لديهم صفة الضابطة العدلية لمخالفة المدخنين #عاجل,0,Jordan. Ministry of Education: School liaison officers with the status of judicial officer for the offence of smoking.
arb_96939cf6fb49442694fb4cc3e0a62892,التي توفيت بالاردن .. مدير آية عادل يكشف تفاصيل جديدة عن حياتها الزوجية #خبرني #الأردن,0,The director of a fair verse reveals new details about her married life.
arb_a36f351cd3b22a71f6a0b77fb15a66f1,تحت تأثير المخدرات يحوّل المنطقة إلى كارثة بسيارته في أنطاليا #عمون #تركيا,0,"Under the influence of drugs, he turns the area into a disaster in his car in Antalya."
arb_e63866189a9aab9075cdb4d4d78e7518,رومانيا.. تعرضت امرأة للإغماء فور سقوط كتلة ثلجية عليها أثناء مرورها #عمون,0,Romania... a woman fainted as soon as an ice block fell on her as she passed.
arb_1e76d34effc3a3a84148836fc80ac200,ولعت ...خبير التأمينات والاعلامي موسى الصبيحي يطلب من جلالة الملك انصافه بعد تهكم وزير العمل خالد البكار عليه كما يقول امام النواب,0,"And the insurance and media expert, Moses Al-Sabihi, asked His Majesty the King for his justice, after he had mocked Labour Minister Khalid Al-Bakkar on him, as he said before the deputies."
arb_ec5845972dd01448b831a7e6337cfdd4,"ترامب يعتزم بيع إقامات ""ذهبية"" مقابل 5 ملايين دولار للبطاقة",0,Trump intends to sell gold for $5 million a card.
arb_0c78bb4e8270008bb2d219a25231f44c,رد رئيس الحكومة نواف سلام على النائب جبران باسيل خلال جلسة منح الثقة للحكومة,0,The response of Prime Minister Nawaf Salam to Deputy Jibran Basil during the Government &apos; s trust hearing
arb_964473b428f246ddce04851238029571,"لبنان... غارة إسرائيلية على مركز ل""حزب الله"" تقتل وتصيب 4 أشخاص",0,Lebanon... an Israeli raid on a Hezbollah center that kills and injures four people.
arb_4fd272fd2aefcee9ed88c0db74b3b479,اختارا الأرقام نفسها صدفة... لبناني وشقيقته يفوزان بجائزة قيمتها 124 مليار ليرة (فيديو),0,They picked the same numbers by accident... a Lebanese and his sister wins a 124 billion-dollar prize.
arb_ac992bca6f98f17c097ea93c05019db4,"أحمد الشرع: موالون للأسد ودولة أجنبية يقفون وراء الهجمات.. وسنحاسب المتورطين حتى لو كانوا ""أقرب الناس""",0,"Ahmad Al-Shara &apos; a: loyal to the lion and a foreign state are behind the attacks... and we will hold those involved accountable even if they are ""the nearest people."""
arb_e7c2d35ea5452b0e3d3d9d82e3aa115a," الأحداث في #سوريا ستؤثر على المسيرة وسنعيد ترميم الأوضاع بقدر ما نستطيع
 موالون للأسد ودولة أجنبية وراء الهجمات على قوات الأمن",0,"The events in Syria will affect the march, and we will restore the situation as much as we can, loyal to the lion and a foreign state, behind the attacks on the security forces."
arb_53633fb798d97f7033ae2eaaf5dd5d8a,الإمارات ترحب باتفاق اندماج قوات سوريا الديمقراطية ضمن مؤسسات الجمهورية العربية السورية,0,The United Arab Emirates welcomes the agreement on the integration of Syria &apos; s democratic forces into the institutions of the Syrian Arab Republic.
arb_b408422f9558fc060716d11140cfe710,أعلن مصدر بوزارة الدفاع في تصريح لـ سانا أن مجموعة من فلول النظام البائد حاولت مهاجمة بوابة إحدى الثكنات العسكرية بريف اللاذقية,0,"In a statement to Sanna, a source at the Ministry of Defence announced that a group of remnants of the former regime had attempted to attack the gate of a military barracks in the Latakia countryside."
arb_b34951fa9db2bde47bcd18880ec271fc,"الرئيس السوري أحمد الشرع:

 لن يذهب هذا الدم سدى دون محاسبة أو عقاب ""حتى لو كان أقرب الناس إلينا"" ",0,"Syrian President Ahmed Al-Shara': This blood will not go in vain without being held accountable or punished, even if it is the closest people to us."
arb_fffb76ebe0d8d5ff1e39747c9b2b7d1a,"""يضيق صدري فيه"".. الرئيس السوري أحمد الشرع يصف شعوره داخل القصر الرئاسي ويعلق : مصمم على تحويله بحيث يأتي منه خير كبير لسوريا",0,Syrian President Ahmed Al-Shara' describes how he feels inside the presidential palace and comments: determined to transform it so that it will bring great good to Syria.
arb_1db5bbca7f1c6c31f8d4fcbeba775c77,يا ريت هالمحطه تكون أكثر مهنيه ومصداقيه بنقل اخبار المجازر على حقيقتها رغم أنها مقارنة بالمحطات الغربيه الأخرى أصدق منها لكن نتمنى أن تكون أقل تحيز و مورارة لجهه دون اخري,0,"Rhett, the station is more professional and credible by transmitting news of the massacres for what it really is, even though compared to other Western stations, it's more true than that, but we hope it's less biased and better for one side than another."
arb_5e378a0f1f3d079fd6f030fa49cc6ff7,هل كان باستطاعة الأمم المتحدة تسريع استجابتها لضحايا الزلزال؟,0,Could the United Nations have accelerated its response to the victims of the earthquake?
arb_5c166e639a1a937947b01abc3d39b3af,سوريا تعود إلى عضويتها الكاملة في المنظمة الإسلامية للتربية والعلوم والثقافة,0,"Syria returns to its full membership in the Islamic Educational, Scientific and Cultural Organization"
arb_1789ef1fea8ff9d5a59bc8b755433c62,حرصاً منها على حقوق المواطنين في جميع المناطق، محافظة ريف دمشق، تعلن بدء استقبال الشكاوى والطلبات من المواطنين المتضررين من الاستملاكات الواقعة على عقاراتهم.,0,"With a view to ensuring the rights of citizens in all regions of the Rif Dimashq governorate, it is announced that complaints and requests from citizens affected by the acquisition of their property will begin to be received."
arb_2cc00acd0ba65cb2653dc504d72805c6,"عضو لجنة صياغة الدستور السوري ""أحمد القربي"" في تصريح إعلامي: 
- اللجنة تعمل بشكل مستقل دون تدخل من أي جهة.",0,"Member of the drafting committee on the Syrian Constitution, Ahmed Al-Qirbi, in a media statement: The committee operates independently without interference from any quarter."
arb_b150e305b612733d9a4b99fe9ed66f42,"عضو لجنة صياغة الدستور السوري ""أحمد القربي"" في تصريح إعلامي: 
- الإعلان الدستوري خطوة جيدة للوصول بسوريا إلى دولة الحق والعدالة بعد تاريخ من الاستبداد.",0,"Member of the drafting committee on the Syrian Constitution, Ahmed Al-Qirbi, in an information statement: The Constitutional Declaration is a good step for Syria to reach a State of truth and justice after a history of tyranny."
arb_3abd9f74aaa7f1e8fa33daf75739dd5a,"بفضل جهود الفرق الفنية المختصة، إعادة التيار الكهربائي ومياه الشرب إلى منطقة ""الحفة"" بمحافظة اللاذقية، بعد إصلاح الأعطال التي تسببت بها فلول النظام البائد.",0,"Thanks to the efforts of the competent technical teams, the electricity and drinking water were returned to the Al-Hafah area of Latakia governorate, after the damage caused by the remnants of the former regime had been repaired."
arb_33e6a5e8582ebaaf014d0e12a5d1267f,"عضو لجنة صياغة الدستور السوري ""أحمد القربي"" في تصريح إعلامي: 
- عملنا على صيانة الحقوق والحريات بما يتوافق مع الظروف الاستثنائية التي تعيشها سوريا.",0,"Member of the drafting committee on the Syrian Constitution, Ahmed Al-Qirbi, in an information statement: We have worked to safeguard rights and freedoms in accordance with the exceptional circumstances of Syria."
arb_cb6e655e23f4085e9cc68138df0ed0cc,غزة العرب تتحدى ريفيرا ترامب.. هكذا ستُعيد خطة مصرية بإجماع عربي الأمل للقطاع,0,Gaza challenges Rivera Trump... so an Egyptian plan will be restored by Arab consensus... with hope for the sector.
arb_6922343f3d862a6d53a60bdc4ca93a82,قال الرئيس الأمريكي دونالد #ترامب، إنه لا أحد يريد طرد سكان قطاع #غزة، وأنه لا أحد سيجبرهم على المغادرة، وذلك في أحدث تصريح عكس تناقضاً في الموقف الأمريكي تجاه قطاع غزة.,0,"U.S. President Donald Trump said that no one wanted to expel Gaza Strip residents, and that no one would force them to leave, in the latest statement to reverse a contradiction in the U.S. position towards the Gaza Strip."
arb_1f7fe63acc5ed715a7ce44db90cc48af,وزير الخارجية الأمريكي يرسم الصليب على جبهته خلال لقاء تلفزيوني,0,The U.S. Secretary of State paints the cross on his forehead during a television interview.
arb_e3f36c2e1ae9fd6da857dcc09dabd16b,توقيع اتفاق يقضي باندماج قوات سوريا الديمقراطية ضمن مؤسسات الجمهورية العربية السورية والتأكيد على وحدة الأراضي السورية ورفض التقسيم,0,"The signing of an agreement to integrate Syria &apos; s democratic forces into the institutions of the Syrian Arab Republic, to affirm the unity of Syrian territory and to reject division"
arb_f63aa2601e6005b2f7359d7362b9802a,السعودية تُرحّب باتفاق اندماج قوات سوريا الديمقراطية ضمن مؤسسات الدولة في سوريا,0,Saudi Arabia welcomes the agreement to integrate Syria's democratic forces into Syria's State institutions.
arb_ee0ae080cab447abbd4e6d778be54a02,الكويت: اندماج قوات سوريا الديمقراطية بمؤسسات الدولة السورية خطوة لتعزيز الأمن والاستقرار,0,Kuwait: Integration of Syria &apos; s democratic forces with Syrian State institutions as a step to enhance security and stability
arb_b9a5d515958eee966ec3ce54bdaf152d,الوزير الشيباني يجري اجتماعات مع بعثات دبلوماسية لإحاطتهم بالوضع الأخير في سوريا,0,The Cheyenne Minister is conducting meetings with diplomatic missions to brief them on the recent situation in Syria
arb_9b123d9ce58a57c40a8b1774497e10db,بيدرسون يرحّب باتفاق اندماج قوات سوريا الديمقراطية في مؤسسات الدولة السوريّة,0,Pederson welcomes the agreement to integrate Syria's democratic forces into Syrian State institutions.
arb_100c8a16ca9d7652baa59262a1062b2a,الرئيس الشرع يجتمع مع ثلة من المشايخ وطلبة العلم في العاصمة دمشق,0,The President is meeting with a bunch of elders and flag students in the capital city of Damascus.
arb_af2a85d2612f17134849f5ac70719eab,تحديد الفترة الانتقالية بـ5 سنوات والفقه الإسلامي هو المصدر الأساسي للتشريع فضلا عن الفصل التام بين السلطات.. أبرز ما نصت عليه مسودة الإعلان الدستوري التي وقع عليها الرئيس السوري أحمد الشرع,0,"The five-year transitional period and Islamic jurisprudence are the main sources of legislation as well as the complete separation of powers, most notably in the draft constitutional declaration signed by Syrian President Ahmed Al-Shara &apos; ."
arb_dcc3d3326e7711e20d25808ed3a7abf7,"السيد الرئيس ""أحمد الشرع"" خلال تسلمه مسودة الإعلان الدستوري السوري من اللجنة المكلفة بصياغته.",0,Mr. Ahmed Al-Shara' during his receipt of the draft Syrian constitutional declaration from the committee charged with drafting it.
arb_b0a0f137f4be33971b2298538c4a09b4,#حماس لم تطرح فكرة اعتزالها العمل السياسي ونزع سلاحها مقابل هدنة طويلة الأمد تمتد من 5 إلى 10 سنوات,0,# Hamas didn't put forward the idea of quitting political action and disarming it for a long-term truce of 5 to 10 years
arb_d7771618eba996c7abf4c14bea4f7e7e,"اتهمت الجيش الإسرائيلي بارتكاب أعمال ""إبادة جماعية"" بحق الشعب الفلسطيني منذ 7 أكتوبر.. ما أبرز ما جاء في تصريحات لجنة التحقيق الأممية بشأن الأوضاع في قطاع #غزة؟",0,"The Israeli army has been accused of ""genocide"" against the Palestinian people since October 7, and what has been highlighted in the statements of the United Nations Commission of Inquiry on the situation in sector #Gaza?"
arb_da1130c5da773aafc4d23a2cf0bd7e7a,تستخدمها لرصد معلومات عن الأسرى.. حماس تكشف عن ضبط أجهزة تجسس إسرائيلية في غزة زرعت عبر حوامات صغيرة خلال ساعات الإفطار والسحور ,0,It uses it to monitor information about prisoners... Hamas reveals the seizure of Israeli spy devices in Gaza that were planted through small huts during breakfast hours and magic.
arb_f7485e9d99126584ac349fded033c9d3,"رحلة مراسل بي بي سي لاستعادة بصره والأطباء الذين يبيعون ""علاجات زائفة""",0,"BBC reporter's trip to get his eyesight back, and the doctors who sell ""false treatments"""
arb_c2cb3f15af8780f63f425f9c14103e51,كم يتقاضى المقاتلون السوريون من روسيا؟,0,How much do Syrian fighters get from Russia?
arb_e0d16d9bfbcfeefbb35cd5699c4119f8,"قمة المهزلة بأن ينحدر مقدم البرنامج إلى هذا المستوى الضحل بهكذا موضوع وهو ابن الطائفة التي يتكلم عنها, هذه الفتنة بحد ذاتها.",0,"The ultimate farce is that the presenter of the program descends to this shallow level with this theme, the son of the cult he's talking about, this sedition itself."
arb_9e905209c966b9e947352dc1feb23a77,الحلقة مليئة بالتجاوزات في حق مصر التي لم تتسبب في أي أذى لأي أحد والأخرون يمعنون في التطاول,0,"The ring is full of transgressions against Egypt, which did not cause any harm to anyone, and the others are going to lengthen."
arb_7470cc4fc6d05d0dea7b89aaaefab37b,"هذه ليست الفرصة للتهجم علي مصر. الرجاء عدم الكذب والتهويل وانتهاز الكوارث  
للانقضاض علي دوله عربيه عريقه.",0,This is not an opportunity to attack Egypt. Please don't lie and dread and take advantage of disaster to strike against ancient Arab countries.
arb_ebe1fba7d9b52824529ed6d2deb0a157,هل هذه شعوب التى يقتلون ويدمرون بها حكام وجيوش المستعمر وهى تفرج,0,Are these the peoples that kill and destroy the rulers and armies of the colony who are watching?
arb_018214cc11b574165895f3cf5f04bc36,مع الاسف الشديد جمال الريان لايصلح للادارة البرامج الحوارية  اتمنى ارجاع فيصل القاسم و احمد منصور فهما الافضل في الجزيرة,0,"With deep regret, the beauty of the Ryan is not good for management... the talk shows... and I hope that Faysal al-Qasim and Ahmed Mansour will return... their best understanding on the island."
arb_8427d183500b1f22e4c98256715cb86e,يا الجزيرة إسألونا  أسئلة سهله وبسيطة إن شاء الله سنتعلم ونتطور وسنجاوب مثل هذه الأسئلة الصعبه و إن شاء الله قريب.,0,"Island, ask us simple and simple questions, if God will, we will learn and evolve, and we will miss such difficult questions, and if God wills, soon."
arb_62036440783e34e6c65d6361254b51f4,عجلوا في سقوط بشار الاسود حتى يتفرغ جند الشام في تحرير الاقصى فمادام الاقصى اسيرا عن اليهود فسوف يتفننون في اذلاله وهدمه,0,"Hurry up in the fall of the lion's har until the Levant's army is free in the liberation of the maximum, and as long as the most captive is the Jews, they will be profaned in his humiliation and destruction."
arb_9aaf28a06f54735d3d61f5072c51bd91,"لم تتطرق الجزيرة الى موسكو ولا الى تل ابيب ولكنها لم تنس القاهرة""وان تصبكم سيءة يفرحوا بها""",0,"The island didn't touch Moscow, nor Tel Aviv, but it didn't forget Cairo, and it would pour you into a bad place to rejoice in."
arb_c7cb9ff37df1264c4a96ec11a5423fb1,ندعوا الله ان يؤلف بين قلوب المسلمين ويخرج من بينهم الشياطين والظالمين .,0,"We pray to God to make up the hearts of the Muslims, and to bring out from among them the demons and the oppressors."
arb_f195028b5583ed39dc93e168de206ec3,اما سالت نفسك لمصلحة من هذا المقال يا فهمي هويدي !!!اتق اللة وفر نصيحتك لنفسك,0,"Either you ask yourself for the benefit of this article, Heady!"
arb_91455cbd1e63121398bc9e727181b732,ياهويدي نحيلك الى المقابلة مع الشيخ الشيعي حسين الحسيني البحريني  على قناة الحدث يوم الثلاثاء للرد عليك,0,"Yahoidi, we refer you to the interview with the Bahraini Shia Sheikh Hussein Hussein Al Husseini on the event channel on Tuesday to respond to you."
arb_7d2a98eac0d9090bc51328179271888f,إن كان يغالط فى أحداث مصر حتى يلوم الإخوان عمال على بطال، فما بالك بما يحدث باليمن.,0,"If he's screwing with Egypt's events until the brothers blame the workers on Buddha, let alone what happens in Yemen."
arb_2ad9cab51e9d3890804d4786cbc44228,"تخافون من الانتقاد فهذا هو حزمكم..وتنشرون الالتعليق الذي لا يعجبكم بعد الغاء الخبر عن الصفحة""حركات مكشوفة""",0,"You're afraid of criticism... that's your packet... and you're spreading the comment you don't like after you cancel the news on the ""discovery moves"" page."
arb_7092b616e87aa0b5c32d97f2860a21b9,إحالة طبيب عيون للمحاكمة بعد تسببه في وفاة مريضة بمصر,0,Referral of an ophthalmologist to trial after causing the death of a patient in Egypt
arb_5d09a39847db580b95c9987f1424e7ee,منصة fbc ليست الأولى.. الملف الأسود لتطبيقات الاحتيال الإلكتروني,0,The fbc platform isn't the first... black file of electronic fraud applications.
arb_3ecba03b70e40db18455c41cca150c26,نجاة سيدة حاملاً من حريق سيارة إسعاف تنقلها للمستشفى في المغرب,0,Surviving a woman carrying an ambulance fire that she's taking to hospital in Morocco.
arb_4f6b2ee90e2577a4b6684d374b89505e,"""مسام"".. نموذج ريادي في العمل الإنساني لنزع الألغام وتخفيف معاناة اليمنيين",0,Maksam... is a pioneering example of humanitarian action to demine and alleviate the suffering of Yemenis.
arb_98bd72b9937af859faaa5d160c9f880d,المياه الوطنية تبدأ تنفيذ 9 مشروعات في تبوك بـ 300 مليون ريال لزيادة نسبة التغطية ورفع كفاءة التشغيل,0,The implementation of 9 projects in Tabok begins with R$300 million to increase coverage and increase efficiency of operation.
