id,text,polarization,text_en
arb_a0cad7cc9689c85c93fac9d187071532,"عبارة عن شلة مال حرامية وهاي كلها فلوس حرام ياخذوها
يجب محاسبة مدير عام الضرائب واصدار بحقه اقسى العقوبات ومتابعة دوائر الضرائب والطابو لان عبارة عن تسليب",1,"It's a critical mass of money, and it's all monstrous money they take... that the Director General of Taxes should be held accountable... and punished with the harshest penalties... and followed up with the tax and tax authorities, because it's a robbery."
arb_185034025e6187bf916b6c7e826cc399,المجلس والحكومه وجهان لعمله واحده واحد بزمر والثاني بطبل,1,"The Council and the Government have two sides of one job, one with one with one with one with a drum."
arb_423e0d28250beb0a32bd5492dd9ae4a3,كل الحكومات العراقية عوضت الدول والشعوب المتضررة جراء الحروب على العراق الا الشعب العراقي وهو المتضرر الرئيسي تفرض عليه الضرائب تذهب لرفاهية الفاسدين,1,"All Iraqi governments have compensated the countries and peoples affected by the wars against Iraq, but the Iraqi people, who are the main victims, are taxed for the welfare of the corrupt."
arb_125fd4df169c37a336f238ec1823c565,كل حياتنا شحده بشحده. حتى حق النا لازم نسعى للشحده مشان انحصله بعد سنه...,1,All our lives are alone... even our right to seek to be alone... is not to be made after a year...
arb_153ef807893197f9c2b5857d6ff4884f,ضريب الي يضربكم ان شاءالله أسوء موسسة تعامل بالبلد,1,"A tax that hits you if God wills, the worst politician in the country."
arb_756912a5c88e55816b8a69c4f213843d,"مثال هذه الاشكال يجب اعدامهم باب بيتهم حتى اشوفهم الجوارين ويكون ردع لجميع
لان قبل ايام زوج يذبح زوجته وبنه بحضنه ويعترف ايكون امي حرضتني على ذبحه",1,"The example of these things must be executed at the door of their house, until I show them the neighboring ones, and it shall be a deterrent to all: for before the days of a husband, he shall slay his wife and his son with his lap, and Icon shall confess, my mother made me slay him."
arb_da59913094354cb8fd7335a581e7d868,بارك الله فيكم ياابطال والله يلعنكم ياابوها وزوجته ولكم طفلة حرام عليكم,1,"God bless you, heroes, and God curse you, her father and wife, and you have a child who is forbidden against you."
arb_8dea79cadf65e87b22d7a56f4567b267,العنف الأسري رفع يد الأب والأم والأخ الأكبر عن رعاية أولادهم وفسادهم بدور الإيواء لعنة على كل من يريده قانون أوربي وضعي يا فاسدين اوعو يا عملاء نعم نعم نعم للقانون الاهي الجعفري,1,"Family violence, raising the hands of the father, mother, and older brother, from caring for their children and corrupting them in shelters... curse on anyone who wants it under European law and my status."
arb_403f667d8f05e8c95c8137a79cc8f507,ناس بكري قالك اضربو يعرف مضربو علاش حنا بكري مضربوناش عندنا ما دينا طرايح ههه,1,"The people of Bakri said, ""Knock, knock, and know the beaters of Alash Hana with the kicker."""
arb_6aa29c7286d6d1528e5e45424ae78b23,ويطلع القانون الغبي يريد ينطي الحضانه للاب..... حسبي الله ونعم الوكيل من هاي الوحوش مو بشر,1,"And the stupid law tells him that he wants to take custody of the father... according to God and the grace of the Agent, who is the monsters, who are humans."
arb_09745caee9b765a1bba2e429da4acf27,يا ويهبلو تعيا. تقول مننضربش بصح وصلوك. انانضربت بجميع وسائل الضرب. ما. تعقدت ما والو الجييل تاع دروك جايي جوطابل بغا ينضرب ولا يقعد,1,"O Wehblu, awake, thou shalt say, Whom we shall strike right, and pray thee: I shall be struck with all means of beating: what is it? What is it? What is it?"
arb_64f94af7b1a70cd2b18b76fc6ee9df12,شكون ڨالك تضرب اولادك حرام ...اصلا الضرب مليح لتربية...والجرب يعرف,1,They complain that you're beating your kids with a blaze... and pray that the beating is good for raising... and the scab knows...
arb_1690359facee9a6e003baa11d5388081,الحكومة بتاعتنا نفس تفكير الأم المصرية لما بتاخد من ولادها العيدية وتقولهم هتحوشها ليهم عشان هى عارفه مصلحتهم اكتر منهم ,1,"The government has the same thinking as the Egyptian mother when she's taking her birth, and she says, ""They're rogue to them, because she knows their best interests better than they do."""
arb_57cb55e88ed929fc092a69992d6eed64,هوه شكله عايز يعرف علشان يعمل على الفرق دى مراهنات زى المصارعه وتتحول لبرنس,1,"He looks like he knows what he's doing on teams, like wrestling and turning into Prince."
arb_60d755d71e7c68d5be6777d70fddac41,أنا أؤيد جدا رفع كل حاجه في مصر ضرايب اكل شرب بنزين كل حاجه كل حاجه لان طول ما الحمار ساكت العربجي حيزود الحموله زود ياكبير احنا شعب جميل ويستاهل,1,I'm very supportive of raising every need in Egypt... ..a club that eats gasoline... ..every need... ..because as long as the ass silences the Arab and the black of the cargo... ..we are a beautiful people and a good people...
arb_e97dab9e84f716f3d658adeb631aabff,"أحمد الشرع 
لم نأت لنبني قصوراً وإنما لنوفر للشعب السورى حياة عادلة 
قصده إيه بالكلام الماسخ ده ",1,"Ahmed Al-Shara', we didn't come to build palaces, but to provide the Syrian people with a just life."
arb_14c7549470565d1c5e7a5c090bd839e1,يوجد حملة إعلامية ممنهجة تديرها ايران و الكيان الصهيوني و فلول الاسد الساقط ضد سورية والأمن السوري .,1,"There is a systematic media campaign run by Iran, the Zionist entity, and the fallen remnants of the lion against Syria and Syrian security."
arb_9eb8a241e79b72d03edf44521024475a,لعنه الله عليك أو على احمد الشرع,1,God damn it to you or to Ahmed the law.
arb_b7921aca414a05e3730afa6a323a06d7,كافي كذب مخلي صوره فتشوب اكبر مجرم الجولاني حاله حال بشار لا تلمع بي كان رجل يشتغل وي الدواعش كوه تلمع بي حاله حال بشار المجرم,1,"Enough of him lying, sniffing out the biggest jolly criminal in the world... in the case of Bashar... who was a man who was working... and who was dizzy... who was dazzling me... in the case of the murderer..."
arb_77ed55ca1a17b335c5a082a376c18f6c,"بشار الكلب فرعون ما وصل مواصيلو
يجب إعدام بشار الكلب وماهر وأعوانهم",1,"The dog's badge, Pharaoh, what's arrived, must be executed... by the dog's badge, and by their proxies."
arb_dfe8aba1fa8f8d89cdf235d6a963c001,لم نرى من هذا العالم المتوحش الدفاع عن الطائفية السنة ام ان دمنا مباح ودم الاقليات هو مقدس ولكن هم يتسلحون بسلاح الاقليات ليدمروا سوريا هناك مخطط قذر يحاك لكل المسلمين بالشرق الأوسط وعلينا ان نكون بكامل اليقظة والجاهزية,1,"We didn't see from this wild world the defence of sectarianism in the year, or our blood is sacred, and the blood of minorities is sacred, but they are armed with a minority weapon to destroy Syria."
arb_8720e46dc7502b1f5d7dbb18bf2697d6,لعن الله من قتل عنصر أمن ومن قتل مدني بسبب طائفته وكل من دعمهم حتى لو بكلمة. وحرم الله عليهم رحمته في الدنيا والآخرة.,1,"God cursed those who killed a security member, and those who killed a civilian because of his sect, and all those who supported them, even with a word. God forbid upon them his mercy in the world and in the afterlife."
arb_a0f514ca768cd26c52f887644fcbaf7b,هي مقطع فيديو ل ارهابي الجولاني ببيوت العلويين شوفو الارهاب تبعن من افواهمم...,1,It's a video of a Golan terrorist in the houses of the Alawites.
arb_814e8c68b8ba0aa86bcb71d9fae7b37a,مع احترامي بحياتا سورية ما كان فيا حروب طائفية . كان في شيعة ايرانين وعلوية( اسدين ) ضد كامل الشعب السوري الواحد,1,"With respect for Syria's life, there were no sectarian wars in the Shia of Iran and the Alawite of Assad against the entire Syrian people."
arb_45d2a725f013f95353065434a110324a,ليش ماتعلقو على الإتفاق التاريخي بين الحكومه السوريه بقيادة البطل السيد الرئيس احمد الشرع وقوات سوريا الديمقراطية ياقناة الفتن والعهر,1,"The Syrian government, led by the hero, Mr. President Ahmed Al-Shara &apos; a, and Syria &apos; s democratic forces, are intrigued by sedition and debauchery."
arb_27cc88d532252b941d0216f8ac36aa4f,عصابه الجولاني تقتل الناس العزل والابرياء,1,The Golan gang kills unarmed and innocent people.
arb_75df1190b34ce5d7522ecbc85a040ff9,هاد الديكتاتور الصغير جدا افلس وسيفلس تونس على خطى لبنان.,1,Had the very small dictator bankrupted and bankrupted Tunisia in the footsteps of Lebanon.
arb_0fd8372711cca861b38305456a6e2322,خدمات ديونكم يا افشل نظام وجد على وجة البسيطة,1,"Your debt service, failure of a system found on the face of the plain."
arb_f60413914f1b8f45ff8cb935e1151e1c,حكومه بتستخف بشعبها كفايه قرف الله يخربيتكم,1,A government that underestimates its people... enough of God's shit to ruin you.
arb_c09af8c94956f911bec6ce5c4f3a80e1,بطقصدكم النقود في البينوك السوسريه بعد الكروش ما تتعبا الاول مغتلس يسلم حرامي وحرامي يسلم حرامي والبلد على الله حكايتها,1,"With the money in the Swiss bank after the Crusades, the first of you, a dirtbag, delivers a thief and a thief, and the land shall deliver to God its tale."
arb_a03acf8d8ef493dbd5283014f4501fd6,ياعم انتوا سكرانين عالطول كده مافيش حد فيكم صحي من الغيبوبة ال انتوا فيها,1,"Uncle, you're too drunk to be healthy from the coma you're in."
arb_18e9df938c1d44bd8d8f427d37f25a1a,هل ستتم اقالة قانون المالية؟ هذا الصحيح، بعد ما عدا بيها بيها القانون أقالها باش الناس تقول هوا باهي و لكن اذا لم يغير القانون فهو مجرد تلاعب و تخدير لعقول مخدرة,1,"That's right, except Bash said it, people say, ""Whoa, whoa, whoa, whoa, whoa, whoa, whoa, whoa, whoa, whoa, whoa, whoa, whoa, whoa, whoa, whoa, whoa, whoa, whoa, whoa, whoa, whoa, whoa, whoa, whoa, whoa, whoa, whoa, whoa, whoa, whoa, whoa, whoa, whoa, whoa, whoa, whoa, whoa, whoa, whoa, whoa, whoa, whoa, whoa, whoa, whoa, whoa, whoa, whoa, whoa, whoa, whoa, whoa, whoa, whoa, whoa, whoa, whoa, whoa, whoa, whoa, whoa, whoa, whoa, whoa, whoa, whoa, whoa, whoa."
arb_5741b8c8dd0f07d03a8df7237e14f132,مادام اللي يحكموا ويسيروا في البلاد جماعة أدب وحقوق البلاد ماشية في هاوية لا حلول ولا استراتيجيات ولا تخطيط الكلو بعلي ودز هكاكة...,1,"As long as they rule and walk in the country, a group of literature and the rights of the country shall live in a abyss of no solutions, no strategies, no plans for Chloe Bally and Buddha..."
arb_ed4b6a30eb2de5a5d1b76e8d8b137aab,كلا كلا للتعديل واكو صح عنف اسري بالعراق واكثر الدول احنه بسبب الاجواء الي نعيشها احنة وسبب الخمر وسبب الكبسله وسبب المال وسبب الحرمان والضحيه الاطفال واكوو هواي قصص واحداث وينشرون بيها عل تواصل الاجتماعي والي يكول لا هذا ماعايش بلدنة,1,"No, no, no, no, no, no, no, no, no, no, no, no, no, no, no, no, no, no, no, no, no, no, no, no, no, no, no, no, no, no, no, no, no, no, no, no, no, no, no, no, no, no, no, no, no, no, no, no, no, no, no, no, no, no, no, no, no, no, no, no, no, no."
arb_49dfd84655618c462ba0bf3406742b57,نعم نعم لتعديل نعم لشرع الله كلا كلا للمنضمات الصهيو امريكيه,1,"Yeah, yeah, yeah, yeah, for God's sake. No, no, no, no, no, no."
arb_9e759638b3eca641e7c5b7d0d2e8e582,مهما كلف موجود على الارض الليبيه خير من ميئات المليارات اخذها اللصوص عدمي الوطنيه للخارج ولم يسفيدو منها هم ولا ليبيا والذي يحدث في برقه وفزان شي يفتخر به واقع وليس خيال,1,"No matter how much it takes on Libyan soil, it is better than the hundreds of billions of people who were taken abroad by thieves who were not patriotic, and they did not take advantage of them, nor of Libya, which is happening in its lightning, and the weight of a thing that is proud of it, a reality, not a fantasy."
arb_b4b1eeb620f50aaa4a7b538ad1e7c747,شكرا بن سلمان لدعمه العاهرات وهدم الاسلام بأموال المسلمين شكرا لك/ /قمت بعمل الكفار بأموال المسلمين,1,"Thank you, Ben Salman, for supporting the prostitutes and destroying Islam with Muslim money."
arb_f21e332d738b59c52fb7ffe108a5b743,نباعت رايحين ماخذها بلعبة كرواتيا جزاء واضح منحسب … الفيفا وقطر خوش دعاية سووها,1,"Rahein sold what he took with the game of Croatia as a clear punishment, according to the viva and the tug of Khush propaganda of Suha."
arb_7323539eff0361cd170163dd69a55aed,هدف كوريا يسوه أهداف البرازيل كلهن,1,Korea's goal is equal to all Brazil's.
arb_382590fac8b57e774ae19a3a29570aa9,ع كدا بقي منتخب مصر ف 2009ف كاس القارات كان اقوي من كوريا 2022 ولما لعبنا أمام السامبا ف كاس القارات كنا عاملين جيم عالمي وكانت المباره رايحه للفراعنه ودلعنا البرازيل وقتها مسحنا بكرامه البرازيل الارض وللاسف خلص الجيم للبرازيل 3/4,1,"And when we played in front of the Samba, the Cup of the continents were global, and the game was winding for the pharaohs, and Brazil made us wiped out Brazil's Earth's dignity, and unfortunately, the Cadet got to Brazil 3/4."
arb_863f9cdbb95f38bb3c20cb662bed2e12,كانت هذه اخر رقصه لمنتخب البرازيل في اخر 8سنوات المنتخب البرازيلي كان اظعف وافشل المنتخبات كادائ ومستويات ونتيجه ولياقه منتخب ظعيف,1,This was Brazil's last dance in the last eight years.
arb_80d44a5dd04eeb0190d64a98abde3617,"مشكلة هذا الجيل من البرازيليون انهم اتو في زمن
الأسطورة #ميسي",1,"The problem with this generation of Brazilians is that they came in the time of legend, Missy."
arb_36a3a4d43394dd469fbf4fe694c8f986,منتخب استعراض اخر خمس كووس عالم لم يقدم شي,1,"Elected for the last five-coss show, a scientist who didn't do anything."
arb_149245aecc9f24d5278d462575668060,منذ خروج نيمار والبرازيل منتخب مثير للشفقة وبلا قائد حقيقي,1,"Ever since Nimar and Brazil came out, patheticly elected, with no real leader."
arb_6a4a8f20032a82b6195978c423c5cb94,خلي القهر يكلكم اللي صرفه دبابة اكثر من اللي انصرف على ملعب بنغازي,1,Let vanquish you more than a tank spends on a Benghazi field.
arb_6799990fbd536c115237aab08258bd0c,فلوسنا نحن احرار ندير ملعب ديرو طريق مش خير مانعطهن الأتراك وسوريه ويرقد فى ديار نومك فهمك اكفيه,1,"If we're free to run the Diro stadium, it's not the best way to give them the Turks and Syrians and lie in your sleep home."
arb_92e2ec5026bdf4ca77368ea0ad26d6e5,لما نكسب الكاس هنبعت المكسيكي يجيب المفتاح وتتحسبلوا بطوله من ضمن البطولات الوهميّة الا عنده,1,"When we win the trophy, the Mexicans answer the key, and they think of its height in the imaginary championships, except for him."
arb_d5296d90ce602ee7ec14a2cd987893d4,لما تكون عارف اللي قدامك انه عبيط بس مش قادر تقوله في وشه احسن يعمل تصرف يخلي كرامتك في الأرض,1,"When you know what's in front of you, he's a idiot, but you can't say it in the best way, and he's doing something that's ridding your dignity on the ground."
arb_82bb0a2f79946a14b3cc349fca056742,"اخيرا شوفت انفانتينو مذلول ومش قادر يقعد حتي
ولما يجي الدول العربيه يقعد ويحط رجل علي رجل
قدام ملوك وحكام الدول العربيه",1,"Finally, I saw an humiliated Infantino, and I couldn't stand until when he came to the Arab countries, he sat down, and a man landed on a man before the kings and rulers of the Arab countries."
arb_985cafb97c0207543742beba03b9807e,خلوه عندكم لا حاجة للوداد به خللوه، أحشوه على رأي عادل إمام,1,"You don't have to be a parent. It's flawed. I stuff it on a fair mind, imam."
arb_144d172a5673ee52f193ae9252be685b,من يلبس قميص الجهلي أصبح نجسا و لن يعود إلى البيت مرة أخرى,1,Whoever wears my ignorance shirt has become unclean and will never come home again.
arb_a4c0172c42bf2a73047b320fece67b75,"ياجماعة الحاجات دى بتجرح القطيع الأبيض جامد من التوتة ..
من فترة كانوا بيسموا كاس العالم للأندية البطولة الاونطة الودية عشان يصبروا نفسهم على فارق السنين الضوئية.. لكن كده كتير عليهم",1,"People, the need to cut the white herd is frozen of raspberry from a time when they've been calling the World Cup for friendly clubs, because they've been patient over the light years, but that's a lot of them."
arb_8402cde5135706ac245788237b77a303,خايف ياخده ورا مصنع الكراسي فى البيت الأبيض,1,Jafe takes him to the chair factory in the White House.
arb_6fca353c01b74914416cec64fd3326d7,حتى بمعادلتك انت الامر متوقع فيه فرق بين عقد موقع 2010 _فقطر بدأت في ابرام عقود ملاعبها في 2010 _وعقد في 2024..ومع ذلك أرقامك كاذبة,1,"Even with your equation, it's expected to make a difference between a 2010 site contract, a country that started to enter into its 2010 playground contracts, and a 2024 contract, yet your numbers are false."
arb_5883af4c6a66f591ad63f02adefb65a0,"الله حيهم
هونغ ميونغ اعرفك معدل من يوم يومك
نريدك تسحق الاردن
عمان على كيفك وياهم
بس اهم شي الاردن اخوي اخوي بعد مانوصيك",1,"God gives them life, Hong Myung. I know you, adjusted from your day. We want you to crush Jordan."
arb_039d73de613a1af2806f7d15e2830a49,ونحنا وين وقطر وين يالهبل قطر هلبتنا ب100 سنه ملعب بنغازي يعتبر انجاز عظيم بالنسبه لدوله واقفه ليها اكثر من نصف قرن,1,"We, Wen, Qatar, and Yen, a vagina, a 100-year-old country, a Benghazi Stadium, is a great achievement for a country that stands for more than half a century."
arb_1afcf5a145f464cb04ada65b5842845e,نص المليار مش حاجة كبيرة صارفهن دبيبة في 36كيلومتر قطران في مصراتة..الموضوع عادي في ليبيا ماتشغلش روحك,1,"The text of a billion dollars isn't a big need, and they've got a dip in 36 kilometers of tar in Egypt... the subject is normal in Libya."
arb_2da20c21f221a14c7384f0784a1e0190,أنا اعرف أن قطر تستحق التنظيم بسبب كل المرافق و البنية التحتية و الخبرة في التنظيم ، لكن يجب أن ينظم كل مرة في بلد عربي و إلا فالتسمية المناسبة لها هي كأس قطر او كأس سمو الأمير,1,"I know that Qatar deserves to be organized because of all the facilities, infrastructure and organizational experience, but it must be organized every time in an Arab country, otherwise the proper name for it is the Cup of Qatar or the Cup of His Highness the Prince."
arb_b14da4a23b882cf9a03fd243979b016b,بطولة تستغلها صفحات الشيتة و إعلام الزيڨو لإثارة الفتنة بين الشعوب العربية المسلمة,1,A tournament that is being used by the Shitah pages and the Zew media to inflame the Arab Muslim peoples.
arb_7df84cba1d13b4dfa69f975870ad4e4d,دا الإعدام شويه عليه دا مجرم موتها ودخلت انت السجن أو اتعدمت مفكرتش بولادك الله يلعن الا ربوك,1,"It's the death penalty, the murderer, her death, and you went to jail, or you ran out of ideas about your son, God damn it, except your bosses."
arb_3803691c9db13199cc3b973c9b47d633,مدام فالمحلة ببقي الصيع والبلطجية كلو كدة,1,"Ma'am, the shop's still fresh and the thugs are chilly."
arb_6fd0d52e812c388a3e3c309ddd857d54,انا عاوزه اعرف البلطجيه اللي زي دول بيتجوزوا ليه وهما عارفين نفسهم ميتعاشروش يوم واحد ونهايه جوازهم يا طلاق يا جريمه,1,"I'd like to know the thugs who dress up as Dol Petguzwa and who know themselves, Meatsharuush, one day, and the end of their passport, divorce, crime."
arb_3f43e3f744f01b2e02cc9552b4cba89d,اى ابن العبيطه دا خلاص مش عايزاك مع السلامه لكن دا متخلف,1,"I don't want to say goodbye to you, but I'm retarded."
arb_682981dd1d3417693b8ee9ce53c928e5,حسبى الله ونعم الوكيل ده مش بنى أدم ده حيوان هو الجواز بالعافيه ربنا قال وفارقهن بالمعروف بقينا فى زمن مقرف ربنا عليه الخلاص,1,"For God's sake, and for the Agent's sake, this Adam did not build an animal, which is the passport to his well-being, our Lord, said, ""And their difference of favor is that we remain in a disgusting time, our Lord, upon which is salvation."""
arb_e75cca3c94b783dcb6db305623c0f09d,انتم أعلام لانتشار العنف الأسري لانكم تشجعون على الفساد,1,You're flags of widespread domestic violence because you encourage corruption.
arb_ceecae45668eafed2a967fb31e77b0ec,سامعين بآخر جيلات المرحوم ...هاي سوالفكم التعبانه مثل سوالف البعثيه من كانو يضحكون عالناس من انتصرنا عالاعداء والامريكان واصلين لبغداد ...والله اذا مو اعتقالات عليكم ودك سجون مايعمر هالبلد,1,"Listen to the last generation of the late, hey, your tired salafs like the Baath... who laughed at the people of our victory... and the Americans, you go to Baghdad... and God, if you don't arrest you and your prisoners, what's going to be in this country?"
arb_c74670e9078408a68cb97310ba6740ff,إذا الإملاء غلط والكتابة صعبة وتطبيل للقانون الداعشي كيف يتطور المجتمع؟؟؟,1,So dictating is hard to write and drumming to the law of religion. How does society evolve?
arb_a6117e2f14a4709e8b39688824372d28,ونطلب قانون يحمي الرجال من العنف الاسري من النساء المسترجلات والدايحات وبنات ملاهي والمقاهي والسلكونيات عيب عليكم عنف اسري هوه وين بقت مره تمشي على طريق الصحيح ماخليتو بيهن حض,1,"And we ask for a law that protects men from domestic violence from women who are masculine, cabaret girls, cafes, and seconics."
arb_f10e7405bbbd75abe49a30e28010e35b,مو الي ذي ده مش راجل ولا شم حاجه من الرجولة وانشاء الله هيتحبس,1,"Moe, who is not a man, nor smell a need of manhood, and the creation of God shall be imprisoned."
arb_284230f85d30f304af216a63d4596592,ايه الكفر ده ما يطلقها وسيبها بالمعروف ايه الغل والجهل والوساخه دي المفروض يتعدم في ميدان عام والله,1,"That's what he calls it, and he's gonna do it with favors, you grudge, ignorance, and dirt that's supposed to be missing in a public square, and God."
