id,text,polarization,text_en
arb_a5ff5ab85744af5a98e72134192595c6,"لعبة كرة القدم والمال الكثير 
شهرية العب في نادي كرة القدم،، تتعدى شهرية 600 عامل يومي في مصنع يصنع الاكل الباس وكل مايلزم الحياة، اين الخلل هنا من فضلك استاذ في وقت العالم يعيش الزمة اقتصادية وحروب ودمار وفرار من البلدان اينا الانسانية هنا",0,"Football and money are a lot of monthly games at the football club, over 600 workers a month at a factory that makes food dress and all it takes to live, where the imbalance here, please, is a professor of the world's time, who lives in economic time, wars, destruction and flight from the human countries of Ina here."
arb_dbd1f195841a85cdd083a4b979de2140,دخلتوا فيه  مثليه وسوالف خارج الموضوع تماما …  لا اعلم بذلك — وعلى اساس ان الريال  من ذوي الاخلاق والتقوى ويعبدون الله  في الخفاء والعلن — طلعتينا من موضوع الكور,0,I don't know... and on the basis that the Reals are moral and pious and worship God in secret and in public... our two flags of the Quor subject...
arb_eba74828489afa26469f4c6c2d1f60e0,"عايزة أقول حاجة بس * مش خايفة من المجتمع يبلعني و يعملني شيخة 🌚 ..
ديكورات رمضان شخصيات الفنانيس و الأشكال دي تعتبر تماثيل و بتمنع دخول الملائكة البيت طول الشهر 🥲 ،  الحسنات ⬅️➡️🔽🔼
- الناس بتزعل أوي من رأي الدين بس لو قولنا إن التماثيل و الصور في علم الطاقة بتعمل طاقة سلبية كله هيقوم يكسرها و عن اقتناع .. 🙂",0,"I want to say something that doesn't scare me from society, and I'm working for an old lady... the Ramadan dictionaries of artists and shapes are statues... and by preventing angels from entering the house all month long... the favors... people are disheartened by the opinion of religion... but if we say that statues and images in the energy science of all negative energy... they break it down with conviction..."
arb_803da4d0174da128709f5cb4c9ed3b2d,سيبك انه علم الطاقة اللي انت قصدك عليه هو مش دارسه ..فمش فارقة ... للأسف هو بيقول اي كلام يبان انه منطقي و مفيد و هو كلام فاضي هجص ,0,"He's gonna cry, it's the energy science that you're talking about, he's not going to study it, and unfortunately he's saying anything that makes sense, and it's useful, and it's empty."
arb_b8dd706a2c461ccff0fac8f9b937cac6,علم الطاقة علم وثني ، محرم ، وفالدين الاسلامي مافي اي شي يمنع انك تتصدق بملابسك الا اذا كانت باليه وتعبانة جداً هذي لاتقبل ، وغير كدا تقبل الله,0,"Energy science is pagan, forbidden, and Islamic Valden is anything that prevents you from believing in your clothes unless it's a ballet, and it's too tiring to accept, and it just doesn't accept God."
arb_ac23224cf110dd43ab630aadbde0ae77,"مناوي لو يصل نص مرحله الوعي الي وصلها عبدالواحد محمد نور زمان يكون  السودان يكون عبر.
معركه الوعي من اصعب المعارك
عيال مناوي ليه بزعلو لمن تقول  لا لي حرب 😂؟",0,What if the text of his awareness phase reaches Abdalwad Muhammad Nour at a time when the Sudan is passing through. The battle of consciousness is one of the most difficult battles for Leah with Zalo. Who do you say I don't have a war?
arb_45356b81e7bade56897f331554abd53f,"المعركة الأهم في سوريا الآن هي معركة ""الوعي "" الجامع المانع الغير إقصائي.
#تحديات_سوريا",0,"The most important battle in Syria right now is the battle of consciousness, the non-exclusive of all."
arb_83e9445ec08b7f795a49b536e2cfa548,سيجعلك الوعي المفرط ترى حقيقتهم المخيفه ☠️,0,You'll be overconscious to see the scary truth about them.
arb_dc045b4ab74d3a6b3fb5976548d01955,وهناك من يظن أن الرجولة هي خيانة الزوجة مع أكبر عدد ممكن الفتيات في الحرام، بالنسبة له الرجل هو الذي يجاهر بارتكاب المحرمات و يحكي ذلك لأصدقائه مفتخرا ,0,"And there's someone who thinks manhood is cheating on a wife with as many girls as possible, for him, a man who's willing to commit taboos and tells his friends proudly."
arb_183803a254449579675a883fe9466a09,"التربية الجنسية هي حماية الأطفال من العنف الجنسي أولاً…
كوننا عايشين بغابة",0,Sex education is to protect children from sexual violence first... as we live in a forest.
arb_ccef1e94f578e3e42386787cf08b76e1,من انواع العنف الأسري يدخلونك غصبٍ عنك معاهم بقروب الواتساب ..,0,Some kind of domestic violence that gets you mad at them near the Auxiliary...
arb_0657258c1003901a6df23219e6d88ef6,"المؤثرة الأمريكية سمية أرغابلي: ""تصور الإسرائيليين العاديين للعالم مجنون للغاية.. الإيديولوجية الصهيونية تقوم على تبرير العنف ضد الفلسطينيين، إنه العفن الأخلاقي للاستعمار الاستيطاني الأهوج!""",0,"The American influence is called Argabeli: ""The perception of ordinary Israelis of the world is so crazy... Zionist ideology is based on justifying violence against Palestinians, it's the moral rot of wild settlement colonialism!"""
arb_488a1e30ae70168bffbbf78d20c3c05b,ظاهرة في القنيطرة دعما للجيش السوري في حربه ضد فلول النظام المخلوع,0,A phenomenon in Quneitra in support of the Syrian army in its war against the remnants of the deposed regime.
arb_c00bc1b89913bd90c1c088f16d7e487a,والله شو بدنا نقلكم  طبطبتو عليهم وخبيتوهم بيناتكم على امل تعملو انقلاب وترجع للحكم  ووقت خسرتو طلعتو تقول حرب عالعلويه لا كذابين حربنا مع الفلول مو مع العلوية ويلي انقتلو فعليا اطفالن ونسائهم ينزلو فيديوهات  كل يلي عم يتحارب شباب مسلحه من فلول النظام ,0,"And God, Shaw, we began to transport you, and you kept them hidden in your evidence, in hopes of a coup d &apos; état, and you return to judgment, and when you lost Talto, you said, &quot; War is high, not the liars of our war with the peanuts Moe with the attic. &quot; , and that they actually killed two children, and their women, they took down videos every day after what armed young men were fighting from the remnants of the system."
arb_fba5b3778647c59b2d7f234a3e9dfe9e,"سوريا الجديدة حلم السوريين أنكسر مشهد الساحل براسي متل المشهد الأخير من ضيعة ضايعة.
حتى الناجي الوحيد لم يعد كذلك.",0,"The new Syria dream of the Syrians broke the scene of the coast of Brasie Mettel, the final scene of a lost waste, even the only survivor no longer."
arb_23e5f5e849c8f9fbe93c8c4d6c97841b,هذا مغربي من المغاربة الاحرار .عرا على واقع الدولة العميقة .لي كطحن في الشعب .حيث تحركو تليفونات من جهات عليا باش يحاربوه .المغاربة كونو رجال السمك الا غلا مانشريوهش ونخلليوه عندهم .واي حاجة غلات مانشريوهاش,0,"This is a Moroccan, free Moroccan, naked of the state's profound reality, as a grinding of the people, where they moved telephones from high-level Bash fighting against him."
arb_ac3ad4a867f1af7c8d1cffc35884b7c9,بما أن السعوديه دفعت جبال فلوس عشان تعمل كوره عندها وتبقا نمره واحد في الكوره العربيه وجه الاهلي سيد القاره وزعيم افريقيا هدم كل ده واخد كبيرين السعوديه ورا مصنع الكراسي فطبيعي جعر مصر يبقا هو البطل الحقيقي والاهلي وحش وكخه 👌😃,0,"Since Saudi Arabia pushed the Floss Mountains to work as a Korean, and left one tiger in the Arabic cortex, the face of the people, the master of the continent, and the leader of Africa, to destroy all of this, and to take the two large Saudis, and to see the factory of chairs."
arb_99ea368ff1da69ad81fc9416710367f9,"واحد  منزل تغريدة كاتب:
وصول الفنان جمال سليمان منافس احمد الشرع على الرئاسة.
بنت حمصية معلقله :
العمى ليش الشرع بده يترأس نقابة الفنانين كمان😅😅
#سوريا",0,"One tweeting house: the arrival of the artist Jamal Sulaiman, rival of Ahmed Al-Shara', on the presidency."
arb_01d30429145c72d6c70ae1a3328a35fa,اليهودي جورج سورس صاحب الدولة العميقة ، شخصية مثيرة للجدل،  يتهم بتأثيره على القرارات الدولية دون منصب رسمي له ..,0,"The Jew George Source, a deep-state, controversial figure, accuses himself of his influence on international decisions without his official position."
arb_368e017f65694a62e24bc9969922fba3,"ف خلال 48 ساعة بس 
مصر عملت عظمة وخلت دول الخليج والصين
 ومعظم دول العالم تصدر بيانات ترفض التهج-ير
شابوا لرجال الدولة العميقة . 👌🇪🇬 👏",0,"In 48 hours, Egypt made a great deal of work, leaving the Gulf countries, China, and most countries in the world with statements rejecting the glowing - the young men of the deep state."
arb_90745b8d57ff4592fae2fb40c986991a,المهندس المعماري الذي صمم ملعب تيزي وزو هو جزائري...صممه هو و زوجته'',0,The architect who designed Tizzy and Zoe Stadium is an Algerian... designed by him and his wife.'
arb_3ef0a8fc2b34892b36635b03c91c07df,"لجميع اللي ماخذين مصطلح ( لعنة الوعي ) محتوى ، لو انك واعي صدق ماسميتها لعنه او اتبعت هذا المصطلح 
وبعدين على اي اساس تصنف نفسك بهذا المستوى : وش سويت يا أفلاطون ؟",0,"For all those who take the term ""consciousness curse"" is content, if you are conscious of what you call it, curse it or follow that term, and then on what basis do you classify yourself as this level: What have you settled, Plato?"
arb_6845c4feaf60974f450e52a72360c62d,مشكلة الوعي يخليك تشوف كل الأشياء تافهه .,0,The problem of consciousness lets you know all things are trivial.
arb_266cdc8491856f53468675dad7a099dc,وبالدليل القاطع، وبالوثائق المؤكده، ومن أبويا ذات نفسه، أنا بت جن وفي قول آخر عفريته 😂 ركز على حتة الوعي الفني دي علشان مهمة😂#متواضعة_بطبعي#حد_يديني_فرصة_علشان_أبوظها😂#مكاويات,0,"And with conclusive evidence, with certain documents, and from the parents themselves, I am a jinn, and in the words of another of his hiccups, he focused on even the technical consciousness of the task of a humble, of course."
arb_0e0a9d2fa9d7a6aaf6157f4e59521377,"""إن الإفراط في امتلاك الوعي ما هو إلا علةٌ مرضيةٌ حقيقيةٌ وتامة""",0,Overconsciousness is a real and complete disease.
arb_381028004dff11b90e6c36f080011b6b,في سيناريو صهيوني/ عنصري/ حاقد/ وبغيض، الشرطة الفرنسية تعتقل الدولي الجزائري يوسف عطال بعد تحقيق أولي فتحه مكتب المدعي العام بتهمة التحريض على العنف وإثارة الكراهية والعنصرية.,0,"In the case of Zionist/racial/disguised/disguised French police, Algerian internationalist Yusuf Atal is being arrested after a preliminary investigation opened by the Attorney General &apos; s Office on charges of incitement to violence and incitement to hatred and racism."
arb_50131f526542cafaaa4625e7ed1fa117,أن الرغبة في حبس النساء في البيوت ومنعهن من الحياة والعمل ليس لأن دورهن الطبيعي هو البقاء فيها، بل راجع لشعور مرضي عند بعض الذكور بأنه يحصل على قيمته ك ذكر بالتسلط على النساء..,0,"The desire to keep women in the home and to prevent them from living and working is not because their natural role is to stay in it, but rather because some males feel that it is worth it as a male to dominate women."
arb_ae8448c9c6740c50a6d590cbed7c57c9,ابي اتوظف لان تكه واموت من الاكتئاب,0,"Dad, I'm hired to be depressed and die of depression."
arb_0e1facf3a64256624251a2918625b271,"سألني أحدهم كيف تصف شعور الاكتئاب فقلت:
كأنك قُذفت في قاع المحيط وأنت مكبل بالسلاسل فلا انت تقدر على فتح فمك والصراخ للنجدة، ولا انت تقدر على السباحة لاعلى، عالق ما بين ظلمة المحيط ووحشته! ",0,"Somebody asked me how you described the feeling of depression, and I said, ""It's like you've been thrown into the bottom of the ocean in chains, so you can't open your mouth and scream for help, and you can't swim up, stuck between the darkness of the ocean and its beast!"""
arb_76997a31c6ff5b4401b7c16d6dcdae04,"الاكتئاب (8) أنواع : هندسة ، طب ، it ، محاسبة ، قانون ، صيدلة ، انجليزي ، فيزياء 🤝
ودققو ع المحاسبة",0,"Depression (8) Types: Engineering, Medicine, It, Accounting, Law, Pharmacy, English, Physics"
arb_4f83e888a80afde5772e8ca564f9b5b0,"اشیاء تسبب الاكتئاب :
- الدوام
- طريق الدوام
- الأشكال إلي نشوفها بالدوام",0,Things that cause depression: - permanence - the way of permanency - shapes to be seen in perpetuity
arb_a4010779c834e1f021bae58fee2e143f,"الفرق بين المريض النفسي و مريض النفس:
•المريض النفسي: يعاني من اضطرابات نفسية تحتاج لتشخيص وعلاج (مثل الاكتئاب أو القلق).
•مريض النفس: شخص يتمتع بصحة نفسية لكنه يتصف بسلوكيات سيئة مثل الحقد أو الكذب أو الغيرة.
الأول يحتاج علاجاً، والثاني يحتاج تهذيباً.",0,"The difference between a psychopath and a psychopath: a psychopath: suffering from psychiatric disorders requiring diagnosis and treatment (e.g. depression or anxiety). A psychopath: a person with mental health but with bad behaviors such as hatred, lying or jealousy. One needs treatment, and the other needs politeness."
arb_1cca5bab30354612013f04de6bad6e7f,الأرواح التي إعتادت القلق تظن إن الطمأنينة فخ ، وهي فخ فعلا برافو عليك.,0,"The spirits that used to worry think it was a trap, and it's a trap, Bravo, on you."
arb_a992296411bf978ddd7ed3b122853d36,أحيانا تجعلنا الحياة ندفع ثمن طيبتنا أكثر مما ندفع ثمن أخطائنا. 🥀😥💔,0,Sometimes life makes us pay more for our goodness than we pay for our mistakes.
arb_3220ef76e551149a2ac9a55d1c714c83,"جيت اتابع مسلسل عشان ألهي نفسي القى المسلسل نفس قصتي 
شذي الحياة!
ولا يجيك الانستا مليان ريلزات تذكرك وتقهرك",0,"Geet, I'm on a show because I'm distracting myself, and the show's throwing away the same story as I am, and Miss Million Reils doesn't come to you, remembering you and vanquishing you."
arb_333e7fadc2af01d4491983e145eac7cd,"الاجهاض....جريمة!!!
لو كل سيدة حامل بتفكر تجهض ...
لو تعرف كام سيدة توفها ليها طفل بمرض او نزل ميت من بطنها او بتعااافر عشان تحمل و بتسقط فى اول ٣ شهور
٨ و ١٠ مرات",0,"Abortion... a crime! if every pregnant woman thinks of an abortion... if she knows how many women a child dies with a disease or a dead in the abdomen... or if she gets pregnant and falls in the first three months, 8 and 10 times."
arb_e353bc421b65240b18db0a19c91a1842,"أصحاب النفوس المنتكسة : 
يدافعون عن جريمة المرأة في الاجهاض 
ويحاربون حق المرأة في التستر والحجاب !!",0,The degenerates: defend women's crime in abortion and fight against women's right to cover up and hijab!
arb_0967e7b55a6bbb9cf8c53fd162a56e6f,يقصدوه مطامعهم الشمال الوسخة التي حرمها الله عليهم مثل العري و الحرية الجنسية و إنها تطلق جوزها و إنها تخرج عن ولاية ابوها او زوجها,0,"They go to their dirty northern designs, which God has forbidden them, such as nudity and sexual freedom, and they release their nuts, and they go out of her father's or husband's state."
arb_c88da810cb98419f2a015d44381b421d,مستقبلا بعد مرونة الأسرة...إباحة الاجهاض والعلاقات الرضاءية...من انتم🙂,0,"In the future, after the family's flexibility... the abortion-abortion and consensual relations... who are you?"
arb_1a962352f736874fe2f9953e13c569e0,"بين ارادتي وأرادتك حـُب يعاني
كـ طفل على ابواب الاجهاض",0,"Between my will and yours, a lover suffers as a child on abortion doors."
arb_79aa5577f9c000c952ff1cb5d6bf7a18,انا مش بشتغل فى الاجهاض ...الا بعذر طبى و موافقة شرعية... الاجهاض جريمة قتل فى حق انسان لا يستطيع التعبير 🤚,0,I'm not working on abortion without a medical excuse and legal consent... abortion... a murder against a man who can't express himself.
arb_30285bfb0ca3c7ba6a682784784edf35,كل الحكاية انه قلة دين وتربيه، الولد لو عنده دين مش هيفكر يتحرش ببنت حتي لو عاريه قدامه، و البنت لو عندها دين وأهل يحافظوا علي بناتهم مستحيل تخرج وهي متبرجه.,0,"All the tale is he's a lack of religion and raising it, a boy who, if he had a religion, wouldn't think about harassing a girl even if he was naked in front of him, and a girl who, if she had a religion and a family who kept their daughters, couldn't come out cheerful."
arb_53affc1aa5227ba869164fe38abbf9cd,"لاحظت بعض الناس يصعبونها يعني طفله عمرها ٦ ولا ٥  لبست قصير قامو عليها وعلى اهلها 
ترا الاغلب كان كذا وذحين نلبس عبايه ونقاب ومتسترين احس الناس صايره اوفر بزياده",0,"I noticed some people making it difficult for her to mean a 6-year-old, 5-year-old girl who wore a short dress on her, and her parents, you see, most of the time, it was like this."
arb_0ac9f0a86b7a2407ad1d0a286ed4b963,اكره اكره اكره و اشفق على الناس اللي ماخذين (النرجسية و الاكتئاب و الانطوائية و الشخصية الحدية و ثنائي القطب وووو ) هبّة او يستخدموها بدون ما يعرفوا معناهم بشكل اكثر يعني ممكن تلاقي بنت تطلق حكم على فلانه انها نرجسية لأنها شافت بس سبب واحد من اسباب الشخصية النرجسية بهذه الفلانة,0,"I hate to hate and pity the people who take away the narcissism, depression, obstinacy, marginal personality, bipolarity, and whoo, or use it without what they know more."
arb_25c595006f03af4e6bff56e61cb5e235,"دراسة:
ممارسة الرياضه تخفف من اعراض الاكتئاب
انا مارست الرياضه واكتئبت🗿💔 ",0,"Study: Sporting reduces the symptoms of depression. I've played sports, and I've been depressed."
arb_372e53dcd561a998d186d7cb8334bb8e,"قاعدة في أمان الله بتفرج على بودكاست سعودي فالدكتور وسط الكلام قال ان من علامات الاكتئاب عند الستات إنها لما بتكتئب لمؤاخذة يعني بتتعطل عن آداء مهامها اليومية زي إنها ممكن ماتكونش قادرة على الإشراف على العاملات عندها في المنزل😲🤦🏻‍♀️
ومن هنا قررت أني مش هسمع بودكاست خليجي تاني😰",0,"A rule in the safety of God by watching Saudi Podcast, the doctor in the middle of words said that one of the signs of depression at the sixs is that, when it's depressed, it means that it's not performing its daily tasks, just like it's possible that you're not able to supervise the workers at home, and that's why I decided that I wouldn't hear the Budcastt of the Gulf of Tani."
arb_da52ce2faf72bedd60ce83b0cea43a33,امس ابوي يمدح الي بمسلسل شارع الاعشى ولما شافها تنادي الولد قال اهبييي ماهي سوالفنا ذي غيريها غيريها وانا قاعده ابتسم واهوجس واخاف ابوي يصفقني من ابتساماتي 😭😭  ,0,"Yesterday my father praised me for the Easy Street series, and when she was about to call the boy, he said, ""Ah, my God, what else is it?"" He said, ""Ah, my father is clapping to me from my smiles."""
arb_d23e7741622d01d3844d274b0edb3385,"بناااات احتاج مساعدتكم 
لو عندكم صديقه من ٧ سنوات تعاني من الاكتئاب (الله يشفيها ) لكن من اول ماتعرفت عليها لين الحين وهي نفس السوالف ونفس المشاكل صرت بس أشوفها اضيييييييم لكن هي تشوفني كل شي بالنسبه لها وانا عارفه لو تركتها بتسوء حالتها اكثر 
ايش ممكن اسوي عشان ابعد شوي عنها ؟",0,"I need your help if you have a seven-year-old girlfriend who suffers from depression (God heals her), but from the very first time I've known her, and she's the same problems that I've had, but she's showing me everything to her, and I know that if I let her get worse, I'd be worse off than she is?"
arb_196c46bb03761652a961e582b0ce30e0,"مهما اتفقتو بالصراحة.. هالمواقف يفضل ما تنقال لان ردة الفعل واضحة اما زعل او بيصك عليج زيادة
طنشي وتصرفي بدون ما تسولفين 
ولا تبررين وايد ونطري يهدا ولما يصير نقاش قولي اللي عندج",0,"No matter how frankly you agree, here's what you move, because the reaction is obvious, and either your girdle or your girdle, Alig, add a hunch, and act without what you're trying to do, and you don't justify Wade and Nathir."
arb_695df0cfbc398e69d0f11a15cf052b15,الاسوأ من الأنسان اللي بيستخدم العنف مع أهل بيته الناس اللي بتبرر,0,Worse than a man who uses violence with his own people... people who justify it.
arb_c09fbf4f64bdde1a4a0dce604c8f7b92,الدعتور مثله مثل اي حي سوري .. مفعم بالفقر و حافل بالتعتير و مجبول بالطيبة .. القبض على مطلوب لا يحتاج كل هذا العنف القديم الجديد,0,"Prosecuting like any other Syrian neighborhood, full of poverty, full of depravity, full of kindness, the arrest of a wanted man who doesn't need all this new old violence."
arb_101fd3d26d0fef3c8ca0961fd194777a,"بتسألوا عن معاكسة البنات فقال لها المهم المعاكسه الشيك قالت له عرفني ازاي 🌹😀
بجد معلم الله يرحمه",0,"Asking about the opposite of the girls, he said to her, ""The opposite matter is the check, and she said to him, ""Get to know me, for the sake of God's master, have mercy on him."""
arb_43891b8101942a1e2ce0be8cf9874fca,كانت الفلبينيه تصور لايف تيك توك انها في المطبخ وفتحت الباب وهربت تركض وتصرخ وتقول عايز يقتلني واتصلنا على اخوي كان عند التلفزيون 😂 بلغناه باللايف وصورناه ومن بكرة قطع لها تذكرة وغادرت الكويت والحمدلله خربت بيتها بنفسها ,0,"The Filipino pictured Live Tick Tock, she was in the kitchen, and she opened the door, and she ran and screamed, and she said, ""I want to kill me, and we called my brother."
arb_2922ae660baa03f79812b97eb67d9c45,"انت كمتحرش شو السبب الي تسوي فيه هيك بمكان عام وبطالبةة طالبة يا الله صغيرة  والاسوء لما اهل البنت يقعدوا يستروا الموضوع 
جد بقهر",0,"You're like Shaw's molester, the reason why heck is settled in a public place, and by a student."
arb_a6d6afdd2bea465c2433a6cfc239d78e,"الاختلاط بالحافلات ممنوع
الاختلاط بالجامع مسموح من اجل صحن رز ....دمشق",0,Bus mixing is forbidden. University mixing is allowed for a rice plate.
